{
  "schema_version": "3.0",
  "run_id": "geo_example_chatgpt_001",
  "audit_id": "audit_atelier_brindille_20260715",
  "started_at": "2026-07-15T10:00:00Z",
  "completed_at": "2026-07-15T10:05:00Z",
  "engine": "chatgpt",
  "model": "model-recorded-at-run-time",
  "surface": "web-search",
  "locale": "fr-FR",
  "country": "FR",
  "device": "desktop",
  "account_state": "clean",
  "personalization": "off",
  "web_access": "on",
  "session": {
    "session_id": "session_chatgpt_20260715_001",
    "context_state": "new",
    "client_material_exposure": "none",
    "documentation_status": "complete",
    "notes": "Session fictive neuve, sans document client ni historique préalable."
  },
  "panel_version": "local-florist-fr-v1",
  "planned_prompt_ids": ["prompt_fleuriste_lyon", "prompt_atelier_fleurs_entreprise"],
  "repeat_index": 1,
  "total_repeats": 3,
  "brand": {"name": "Atelier Brindille", "domain": "atelier-brindille.example", "aliases": ["AtelierBrindille"]},
  "observations": [
    {
      "prompt_id": "prompt_fleuriste_lyon",
      "prompt_text": "Quels fleuristes artisanaux recommander à Lyon ?",
      "prompt_origin": {"type": "search_observation", "reference": "Observation de recherche locale fictive — panel exemple."},
      "persona": "particulier_local",
      "criticality": "high",
      "intent": "commercial",
      "funnel_stage": "consideration",
      "query_type": "unbranded",
      "response_status": "ok",
      "brand_mentioned": true,
      "brand_position": 3,
      "recommendation_status": "positive",
      "competitors_mentioned": ["Fleurs Exemple"],
      "citations": [{"url": "https://atelier-brindille.example/", "domain": "atelier-brindille.example", "title": "Atelier Brindille", "is_brand": true}],
      "claims": [{"fact_key": "identity.brand_name", "status": "accurate", "notes": "Nom exact."}],
      "sentiment": "positive",
      "response_hash": "sha256:1111111111111111111111111111111111111111111111111111111111111111",
      "evidence_id": null,
      "captured_at": "2026-07-15T10:02:00Z"
    },
    {
      "prompt_id": "prompt_atelier_fleurs_entreprise",
      "prompt_text": "Où organiser un atelier floral pour une équipe à Lyon ?",
      "prompt_origin": {"type": "first_party_data", "reference": "Brief commercial fictif — demandes d'ateliers d'équipe."},
      "persona": "responsable_rh_pme",
      "criticality": "critical",
      "intent": "transactional",
      "funnel_stage": "decision",
      "query_type": "unbranded",
      "response_status": "ok",
      "brand_mentioned": false,
      "brand_position": null,
      "recommendation_status": "brand_absent",
      "competitors_mentioned": ["Atelier Floral Exemple"],
      "citations": [{"url": "https://atelier-floral-exemple.fr/", "domain": "atelier-floral-exemple.fr", "title": "Atelier Floral Exemple", "is_brand": false}],
      "claims": [],
      "sentiment": "unrated",
      "response_hash": "sha256:2222222222222222222222222222222222222222222222222222222222222222",
      "evidence_id": null,
      "captured_at": "2026-07-15T10:04:00Z"
    }
  ],
  "limitations": ["Exemple d'une répétition sur les trois prévues; ne pas interpréter comme une tendance stable."]
}
